content,chunkId,source
车辆的驾驶部分，清楚地看到车辆的脚踏板和部分内部机械结构，包括脚刹和电动启动装置。所有部件保持着良好的维护状态，显现出Vespa电动车的高品质和精细工艺。蓝色的车身在细节处也显示出精心的设计感。,37d8448cfd77b6b12f6f5319e45e60da,GOWEI
"外卖电动车展示设计和结构特点，如颜色和商标。,GOWEI 外卖车测评",0d1d6db65b4e866c9e30ac1f38c88d72,GOWEI
"两位男性和一个摄影师在仓库外围观察并拍摄靠近装货卡车的活动。,GOWEI 装柜",1c4e4699eefce17c7cd3cef64d23c66e,GOWEI
"焦点同样在电动车的后轮和刹车系统上，也是320mm大尺寸碟刹片，表明后轮同样强调刹车性能。,GOWEI CP900电动两轮车",b7da0e223f5ad1a94b336b015f370d3e,GOWEI
"一辆黑色的Vespa电动车停放在户外绿地上，整洁，背景有高楼和树木。,Vespa电动车应用",8195408f5ebdce8a3f76ad907e1f5dfb,GOWEI
"聚焦于电动车的头灯部分，显示前灯设计和技术细节。,GOWEI 外卖车测评",1dbcbb616e12050ab046d1c734375604,GOWEI
"展示电动车的侧面线条和设计细节。,Vespa电动车应用",563daf7e06b6206aecb0c1ec32cd3129,GOWEI
细节图显示了电动车后轮的减震器和带有设计图案的碟刹片，此处是220mm的碟刹片，强调了其后轮减震和制动能力。,39cd9d395822f46f8f21700091b372af,GOWEI
"外卖电动车在人行道上，突出城市中的应用场景。,GOWEI 外卖车测评",bbb881b6f251dfd581071c076f4fa494,GOWEI
"展示车辆的另一侧视角，呼应中上图，展示设计的对称性。,Vespa电动车应用",1a2eeff45f819aab8eb8e62dcda7f3f8,GOWEI
"此图像展示了一个现代化、简洁风格的室内空间，主要色调为纯白。空间由几个圆形拱门构成，形成了一个连续的隧道效果，增添了未来感和艺术气息。图中心的墙面上有“GOWEI”这一品牌的标志，标志颜色为红色，与白色环境形成鲜明对比。整体设计给人一种简洁而高科技的感觉，适合用作现代产品或公司的展示背景。图像与视频描述中提到的电动三轮车工厂主题可能在此空间的其他部分或在动态展示中。,GOWEI自卸货功能电动三轮车工厂介绍",2b4c818355e09cff89954137187a5652,GOWEI
"送外卖员手握电动车把手，聚焦操作和控制。,GOWEI 外卖车测评",b7a87cf3d9921e04410d92591f011b07,GOWEI
显示了三辆不同颜色的Vespa电动车集中展示，强调多样的颜色选项和设计。,8070d5190731be45f8dd286c2cddf1a3,GOWEI
"另一个角度展示后轮220mm碟刹片和金色的卡钳，更加注重展示了时尚的配色和设计。,GOWEI CP900电动两轮车",8bd7308a61a94862fc4abf1264ce35f3,GOWEI
"显示电动车的尾灯和牌照部分，突出夜间安全性能。,GOWEI 外卖车测评",863473d655764d5b0c21bc417afcd70f,GOWEI
"这是一个大型的仓库，里面堆满了包装好的电动滑板车。仓库的顶部有红色的消防喷淋管道，仓库的墙壁上有很多窗户，可以透进自然光。,打包仓库",3ffda3b3fc53ea492fbd143960f14182,GOWEI
"特写电动车的数字化仪表盘，显示速度和电量等信息，突出现代化技术集成。,Vespa电动车应用",0ee1b4eda1c0672b1465cbf2b7059013,GOWEI
"图中是一个穿着头盔和骑行装备的人驾驶电动车，准备由绿色的巷道驶出，突出了电动车的实用场景和操作者的安全措施。,GOWEI CP900电动两轮车",1e16e82780d67bb1aac8f46f0272069d,GOWEI
穿着工作服的操作人员正在驾驶一辆橙色的叉车，将装有标签'FORTE'的货物箱运送至一辆卡车。,dcab1a590557fd0edd08d0fd60af368d,GOWEI
"一名穿着黄色外套的外卖员在绿树成荫的路上骑行，展现车辆在公园或类似环境中使用的场景。,GOWEI 外卖车测评",2d20f933b0a93c019696ee94c942ef29,GOWEI
"聚焦在电动车的前灯设计，现代感的灯具设计表明了其优良的照明性能。,GOWEI CP900电动两轮车",027541f46814d0a7e009632306d9906f,GOWEI
"视频展示了工人在用叉车将货物装入集装箱的场景。工人驾驶叉车将一个箱子从地面搬运到集装箱内，箱子上贴着 ""ELECTRIC SCOOTER"" 的标签，说明箱子里装的是电动滑板车。,装柜",feb1d54cd2be2cd946252c81b1b2f064,GOWEI
"外卖员在转弯时驾驶该电动车，展示电动车在转弯时的稳定性。,GOWEI 外卖车测评",f88e7277a172bc8b6de9531404fc9014,GOWEI
"另一个角度的仪表盘特写，更加突出驾驶视角下的信息展示与易用性。,Vespa电动车应用",f8af9064680b31adee8c880bee042b0c,GOWEI
"展示了前轮另一个角度的高精度CNC铝制减震，提高了电动车的舒适性和稳定性。,GOWEI CP900电动两轮车",45b3dfa0f7d9d64e4ed7a63b1cd61e30,GOWEI
"叉车正在装卸箱子，箱子清晰地标有'FORTE'的字样，叉车的叉子部分正在操作箱子，准备进行移动或装车。,GOWEI 装柜",3a5a32dfd37f683386a9e37f107a3ef2,GOWEI
专注于电动车的前轮和刹车系统的近景，突出显示其机械部件的质量和设计。,02ae23051f0089271a622bb2c0236a36,GOWEI
"内部构造特写，展示电动车的储物空间和其中放置的安全头盔等物品，强调实用性。,Vespa电动车应用",9dde7b5e1cf4918a15ab63deca9a927a,GOWEI
"叉车正在将货物搬运到货车上，货物可能是纸箱，叉车司机正在操作叉车，将货物从地面搬运到货车上。,装柜",3b815b527833b9b169f95827b410c17e,GOWEI
"着重于内部储物空间，但从另一个角度展示，更加全面地展示存储容量。,Vespa电动车应用",06705f8e209c2db2d6b842d3a6f9a3cb,GOWEI
"从侧面近距离展示外卖员骑行电动车的场景，可能在强调骑行的舒适度。,GOWEI 外卖车测评",4b8d4decf768e72dbf95eb8f5906ccbb,GOWEI
"聚焦在电动车的后轮减震器和轮辋，显示了X型的强化设计和减震功能，强调了稳定性和耐用性。,GOWEI CP900电动两轮车",06340e665883891639d2c10595f504be,GOWEI
"工人正在用叉车将一箱箱货物装进集装箱，货物是红色的纸箱，上面印有英文，集装箱是蓝色的，背景是室外，有蓝天白云，地面是水泥地，旁边停放着叉车和一辆卡车。,装柜",9e6912f99177234adf55b9b56974d740,GOWEI
"在展会上，一位顾客正在试驾江苏GOWEI摩托车公司的电动两轮车。背景中有关于公司的介绍横幅，展示了公司的信息和产品特点。地毯为蓝色，上面有白色的花朵图案。整个场景显得专业且充满现代感。,客户试驾GOWEI电动两轮车",83cdebffe300aa0c7e70f21baebff26e,GOWEI
"聚焦于电动车的前方和驾驶器械，包括后视镜和手把，展示车辆控制部分的细节。,Vespa电动车应用",d6e02e4a113bcf7d2ca483add4c50154,GOWEI
"展示外卖员从侧面钢架上拿取装有商品的塑料袋，体现电动车的实用载物功能。,GOWEI 外卖车测评",a4e95b55b86739bcd2e18dab8263987a,GOWEI
"详细显示了后轮的减震设计和轮辋，再次强调了其高性能的减震和支撑能力。,GOWEI CP900电动两轮车",39561581d6fe1c0d8cef5e5be6f26624,GOWEI
"显示了三轮车的仪表盘，具有明晰的速度、电量显示和一些基本的功能指示，例如“驾驶”模式。,GOWEI休闲电动三轮车介绍",da491b1ad45ed3e1501ba363616561d1,GOWEI
"该场景是在一个仓库里，工人正在将一箱箱红色的纸箱装进集装箱。集装箱已经装了一部分，工人正在将纸箱搬到集装箱里。集装箱旁边还有很多纸箱，工人正在将纸箱搬到集装箱里。,装柜",28df365e8d2d95fd3f774d0977ef8c53,GOWEI
"图像中显示一位穿着棕色外套和戴着白色摩托车头盔的人正在驾驶一辆白色的Vespa电动车。周围环境是一个日晒充足的公园，有绿色的草地和行道树。这种场景表现了Vespa电动车在城市公园环境中的使用情况。,Vespa电动车应用",3e0f46bf7a9eccc077d81fda8809f11f,GOWEI
"同样展示了仪表盘，但关注在速度与电量的另一种显示方式上，提供不同的用户界面设计。,GOWEI休闲电动三轮车介绍",76407bcb54c69936f298c6db1a44a6e3,GOWEI
"聚焦电动车的仪表盘，显示当前速度为24公里/小时，展示其信息清晰易读的特点。,GOWEI 外卖车测评",a4f9bc47ce086ec72ce96bf59510733d,GOWEI
电动车行驶在装饰有现代风格拱门的城市自行车道上，背景是城市高楼，突出其适用于城市环境。,3b6d15f80ea5427e0daed207a366307c,GOWEI
"展示了一个更现代化和科技感强的仪表盘，显示速度和电量，同时包含了“READY”和“SPORT”模式提示。,GOWEI休闲电动三轮车介绍",71f77d1a6cd5e5d0eb86a150ee738847,GOWEI
"显示电动车由驾驶者操作的整体侧视图，强调设计的现代感和实用性。,GOWEI 外卖车测评",c7c806f3dc7f5197288233734bb2f819,GOWEI
"驾驶者正穿戴全套安全装备（如头盔）在桥上行驶，显示电动车稳定性好，适用于多种路面。,GOWEI CP900电动两轮车",3bbafb62bdd87138b231abf012afbff5,GOWEI
"正面全景图，展现了三轮车的完整正面造型，包括品牌标志和车灯，设计现代。,GOWEI休闲电动三轮车介绍",9f2bc23a972746243f9d4a95202be13f,GOWEI
"年轻女性操作电动车，手势动作表明她可能正在讲解电动车的特点或操作方法，适用于营销展示。,GOWEI CP900电动两轮车",2385e60c19134b74c28338e998a61556,GOWEI
"这是一张展示电动版Vespa摩托车的图片。摩托车呈现淡蓝色，配有棕色的座椅和一系列金属装饰，包括前后的灯光和车把上的镜子。这辆摩托车还装备了一种透明的挡风玻璃和后部附加的行李箱。图片背景为一个简朴的工作室环境，地面干净明亮。此外，还可以看到用于充电的黑色设备连接在摩托车下方。整体展示了这款电动摩托车的现代设计与功能特性。,Vespa电动车展示",27817bc2c30fbab254810e4a982b52ae,GOWEI
"同样是全景图，但着重展示了红色款式的三轮车，强调了其鲜艳的颜色和明显的外观设计。,GOWEI休闲电动三轮车介绍",8c60a08370d627f081e49f4c800ffd1d,GOWEI
"集中展示电动车的后轮和尾灯设计，可能强调其安全性和美观的设计。,GOWEI 外卖车测评",2c6172c0ea40104b778f439bac3c4893,GOWEI
"特写电动车头部，展示车型标志和设计细节，强调品牌识别和现代感。,GOWEI CP900电动两轮车",dbc8c728d9e66b87a7e15e9b758ba45c,GOWEI
"显示的是三轮车的座椅部分，特别突出了座椅的设计和安全结构，适合乘客舒适与安全。,GOWEI休闲电动三轮车介绍",85339e6a00f04c19572c3ddc0d1ea25e,GOWEI
这是一张展示典型的浅蓝色Vespa电动车的图片。摩托车配备了前后的镀铬保险杠，皮质座椅，及配有顶部行李箱。车头装有圆形的大灯和风挡玻璃，整体设计显得既时尚又实用。图片背景是一个简单的室内环境，摩托车前方左侧设有一个黑色的摄影灯架。,c9875192050734c20badc9da39162f5b,GOWEI
"展示外卖员在较为繁忙的市区道路上骑行，演示车辆在城市交通中的实际应用。,GOWEI 外卖车测评",4951d93d5fb50aab1f1a196dbadbbd8e,GOWEI
"视频展示了四辆停放在路边的电动摩托车，它们颜色各异，分别为粉色、灰色、绿色和白色。摩托车都配备了后备箱，并带有炫彩电镀大灯。,Q50- B
配置：A20/B20/C20，215电机30H1000W（彩色电机）、12管集成控制器（协昌）、彩色前轮、前碟后鼓刹,300-10双色轮胎，改装件，脚踏电池盒，炫彩电镀大灯，带USB,带塑料搁脚，大座筒、飞机把、大挡风、彩色转把、电镀反光镜、高档压花座垫、铝衣架、尾箱。",9adc2bb77cf7c7924c199018be06f301,GOWEI
"侧面视角，描绘了三轮车的整体设计和较为紧凑的车身结构，突出便捷的入门设计。,GOWEI休闲电动三轮车介绍",a264e2fb9b4e6c772bb2e92a62e58bfe,GOWEI
"座椅特写，突出舒适设计和材质，推广乘坐的舒适性。,GOWEI CP900电动两轮车",0a545e8e40a0e8a1307b411471c13ed5,GOWEI
"手持手机显示外卖订单情况的画面，突出了使用手机接收和处理订单的便利性。,GOWEI 外卖车测评",e42ec328047da5950e4828b6884c459b,GOWEI
"详细展示了三轮车的驾驶舱区域，从另一个角度看，强调驾驶的舒适性和操作便利性。,GOWEI休闲电动三轮车介绍",1ae89a68b1169443f732c75efc6b15b1,GOWEI
"这张图片展示了一辆银色的Vespa电动车，整体设计时尚而经典。车辆配备了前挡风玻璃和一个后置行李箱，显得实用而优雅。背景是一个简洁的摄影棚，使得主视觉焦点集中在摩托车本身。这种设计既突出了车辆的细节，也体现了其作为展示用途的功能性。,Vespa电动车展示",ea1c2d30d86873824e5b8c5fb2acd39a,GOWEI
"身着外卖公司制服的配送员正在查看手机，准备接单或查看配送信息。,GOWEI 外卖车测评",10b8c2c30116ffae80672c7d1a8890c9,GOWEI
"动态侧面视角，突出电动车在公园等户外环境的行驶表现，强调其适合休闲环境。,GOWEI CP900电动两轮车",982109cfd91f88b2f739d051015cde8e,GOWEI
"从后方视角展示了三轮车，侧重于其独特的顶部保护架和紧凑的后部设计，展示了整车的侧后方造型。,GOWEI休闲电动三轮车介绍",fc7824abc336a93d210b4d6afc6f1d1d,GOWEI
"电动车正面低角度拍摄，专注于车辆前部设计和地面的接触情况，展示良好的稳定性和设计美感。,GOWEI CP900电动两轮车",6b023ca0b0305d9025c708ec253d5228,GOWEI
"外卖配送员骑着外卖车在路上行驶，体现了外卖车的实用性及其在城市道路上的灵活性。,GOWEI 外卖车测评",33148617e09348a88973daad04b694ab,GOWEI
这是一张展示Vespa电动车的照片，摩托车呈现深灰色，配备了前后金属护栏和一个后部储物箱。该车辆还装备了透明的风挡和侧镜，展示了其经典而现代的设计风格。整体背景为简单的白色，与黑色支架和地面形成对比，突出了摩托车的细节。,263489b1284d3f23b2d10257adae6913,GOWEI
"电动车快速经过的模糊景象，表达速度感和操控性。,GOWEI CP900电动两轮车",400b4ee989a03b4484f7260117a2ab80,GOWEI
"四辆颜色各异的复古摩托车停放在街道旁，其中一辆摩托车安装了尾箱。,Q50- B 配置：A20/B20/C20，215电机30H1000W（彩色电机）、12管集成控制器（协昌）、彩色前轮、前碟后鼓刹,300-10双色轮胎，改装件，脚踏电池盒，炫彩电镀大灯，带USB,带塑料搁脚，大座筒、飞机把、大挡风、彩色转把、电镀反光镜、高档压花座垫、铝衣架、尾箱。",1e6bb78cd1d82474103ea5b9bac8fd51,GOWEI
"外卖配送员带着安全头盔坐在外卖车上休息，表现了等待订单的一刻，背景为都市建筑。,GOWEI 外卖车测评",c0bcf276ad9b870d410cb0099f120d69,GOWEI
"图像展示了一个GOWEI品牌的休闲电动三轮车。这款三轮车设计现代，配有宽敞舒适的坐座和一个遮阳篷，看起来具有良好的防晒功能。车身颜色为米色和黑色。其具备一个后置的篮子，方便存放物品，整体结构看起来稳固而且现代化，适合休闲出行使用。,GOWEI休闲电动三轮车介绍",5994679caca04bd8e763e7ff2cea1d13,GOWEI
"这张图像展示了三辆不同颜色（蓝色、红色和白色）的GOWEI休闲电动三轮车，停放在一个内部空间内，可能是一个展示厅。电动三轮车设计现代，配备了前窗玻璃和舒适的座椅，适合休闲驾驶。背景中可以见到室内装潢和绿色植物，增添了一些自然氛围。整个场景显得整洁且专业，适合用于展示这类休闲交通工具。,GOWEI休闲电动三轮车介绍",5d01d2ce29f51161afca37bb46717824,GOWEI
"近距离展示外卖车的侧面，突出了车辆的动力装置和品牌标志（GO吉）、加速性能。,GOWEI 外卖车测评",551f6c306a6acea391fa1828b884c899,GOWEI
"女主持人介绍电动车的环境下，散发自信与专业的氛围。,GOWEI CP900电动两轮车",c88765ddcf54a81fa42a015b865ce021,GOWEI
"特写摩托车把手及其操控系统，包括启动和停止按钮，趋向于突出操控的简单性和直观性。,GOWEI CP900电动两轮车",dfb2ee97203555fd35c6a9e4d27a3df2,GOWEI
"细节展示外卖车的电机部分和车架，突显了现代化技术和结实的设计。,GOWEI 外卖车测评",f0481be3bd9f3867d42e3263d35ef27b,GOWEI
"这张图片呈现了一辆GOWEI品牌的电动三轮车的部分近景，特别突出了三轮车的把手和仪表板区域。仪表板看起来很现代，具有清晰的液晶显示屏。图片色彩鲜艳，主要以红色和黑色为主，显示了该电动三轮车的设计注重实用同时兼具美观。,GOWEI休闲电动三轮车介绍",3061a8996ab34025775c4e86a7c64c50,GOWEI
"电动两轮车的存储箱内部细节，包括位于内部的通电按钮。,GOWEI CP900电动两轮车",db1d86ef9dabec971c0bea9579f5e54e,GOWEI
展示了全景的外卖车，聚焦在前灯设计及整体造型，强调了外卖车的设计美观和实用性。,b11f311bf83105e859d015f92dd9899c,GOWEI
"特写GOWEI CP900停放在户外，集中展示车辆的正面和设计细节。,GOWEI CP900电动两轮车",18f717e1d5924d1e08bd1376c2809ca3,GOWEI
"该场景展示了新款战穹五代电摩，该电摩拥有多种颜色，包括黑色、绿色、白色和蓝色。该电摩拥有超大储物箱，并配有靠背，适合外卖行业使用。,这是一个户外电摩产品拍摄（配置拓展：战穹五代 配置:72V30A/60V30A,金宇星35 H1200W电机、12管集成控制器（35AH）、前后300-10建大轮胎、铝轮，前后对置缸碟刹（前220，后180）、带前保险杠（黑色）、带飞机把、带USB接口、铝衣架、靠背。）的场景。（2）关键词：高配置，电摩，外卖车，新车型，可定制（3）视频展示了：新款是针对外卖行业的高速电摩，动力强，续航远，拥有超大储物箱，对外可配置多种颜色，可接受OEM定制",b1ddd4721a75744f666ed5042eb2f38d,GOWEI
"完整展现了外卖车停静时的侧面全视图，重点在于车辆的整体设计和储物空间。,GOWEI 外卖车测评",9b408c2e3aeb4425bc5d3879aec7df15,GOWEI
"电动车的正面和侧面设计，具有USB充电端口的便利功能。,GOWEI CP900电动两轮车",c1e632d19e951f917cc574e3113b5d87,GOWEI
"从侧面展示GOWEI CP900，强调其动感设计和运动风格。,GOWEI CP900电动两轮车",53dd7ab92fcbcd7c2161bcbc8225fec9,GOWEI
"三轮车的后斗被抬高，仿佛在卸货的过程中。该车型可以用来搬运和自动卸载货物，非常适合于建筑工地或农场使用。整体颜色为绿色和蓝色，车身上标有“GOWEI”品牌标识，凸显了品牌形象。,GOWEI自卸货功能电动三轮车",4d4b55ecf92f1b8424c677a1489215a8,GOWEI
"这是一张展示现代两轮电动车的图片。电动车停置在一条城市街道旁，背景是一座建筑和几棵绿树。这款电动车的颜色为浅灰，车身设计简洁现代，配置有后视镜和后备箱，适合日常通勤使用。,GW-RN3--两轮电动车",562c6e929bcf12ee2a3e70486091b8dd,GOWEI
"女主角站在电动车旁，体现了车辆与人物之间的协调与时尚外观。,GOWEI CP900电动两轮车",ac96eea42b66781176d1cf28d873ff84,GOWEI
"近距离特写电动车的前部，展示灯光和车标配置。,GOWEI CP900电动两轮车",37d2331b2faba03c77ff3e835915953b,GOWEI
这张图片展示了一辆停放在街道边的白色两轮电动车（型号：GW-RN3）。电动车外观现代，色彩主要是白色和黑色，带有桔色的装饰标识。车辆配备了后视镜、前灯和一个方便的后备箱。背景是一条平静的街道、绿色的植被和一座建筑，以及停放着的其他车辆。,15231c0c29480bac6010cbc24aee2c72,GOWEI
"“网速快”四个字清晰显示，可能象征该外卖车型具备高效率和快速响应的特点，这也许是视频的标题画面或结束语。,GOWEI 外卖车测评",207e3e1a1f5e47d6f8acd8841fefe752,GOWEI
"斜角视图展示电动车，突出其整体设计和颜色搭配。,GOWEI CP900电动两轮车",d4f9c56df69e99f74c6a07b63330b57f,GOWEI
"三轮车的后斗处于正常的放下状态，完整地展示了车辆的侧面和前部。车辆设计较为坚固，前部配有圆形的大灯和明显的车牌装置，突出其适用性和功能性。车辆位于一个开放的停车区，可能是展示或待售场所。,GOWEI自卸货功能电动三轮车",4eff9d798f2d6007eb858ede857f7429,GOWEI
"女主持人操作电动车的一瞬，突出其便捷的使用性。,GOWEI CP900电动两轮车",fff5c15b7b9e23534b56c085b4f8fc1d,GOWEI
这张图片展示了一辆黑色的两轮电动车（型号：GW-RN3）的驾驶视角。我们可以看到电动车的手把部分，包括左右两侧的控制器，中间位置有一个未打开的翻盖式储物盒。手把上标有一些控制按钮和信息显示，街道和人行道作为背景。,9c6925ec3583de61b4dd4034f3b680d6,GOWEI
"电动车行驶在清新的户外道路上，展示其在实际使用中的场景。,GOWEI CP900电动两轮车",14187b3763fb70368577d623c0862595,GOWEI
"在GOWEI工厂的院子里，两位客户正在测试驾驶一辆蓝色的电动三轮车。背景是工厂的一部分，此处环境宽敞适合进行试驾。一位客户正在驾驶三轮车，另一位则在旁边步行，看起来像是在观察或指导。这为了解客户对电动三轮车的操作感受提供了实地体验的机会。,客户在GOWEI工厂试驾GOWEI电动三轮车",cc13d39da2c091de35b55f01c4794ee0,GOWEI
聚焦于电动车的底盘和悬挂系统，展示其技术细节和做工精良。,b465231e2a1280f3d2117185a32401f3,GOWEI
"这张图片展示了一辆停放在城市街道边的灰色两轮电动车，车型为GW-RN3。电动车前方设有一个圆形的大灯和两个后视镜。背景是一条宽敞的街道和一座现代化的建筑，街道旁种有绿色植物。这种电动车设计简洁而现代，适合城市日常通勤使用。,GW-RN3--两轮电动车",8c5187384f52f1d9654038a0ed70b15c,GOWEI
"图片显示一辆标有麦当劳标志的Gowei品牌电动三轮车正在街道上行驶。三轮车的车厢部分是蓝绿色，侧面贴有多个产品和品牌广告。环境中有行走的行人和丰富的植被，画面捕捉了城市的日常活动氛围。,Gowei电动三轮车日常使用",0d837917076896483166d953e2fd7bbb,GOWEI
"这张照片展示了三名男士在GOWEI工厂的户外空间进行电动三轮车的试驾活动。照片中，一名男士正在电动三轮车上操作车辆，而其他两人站在车辆旁边，其中一位似乎在和试驾者交谈或给予指导。背景是工厂的建筑，天气晴朗，环境看起来整洁。整体来看，这是一个关于产品展示和客户体验的场景。,客户在GOWEI工厂试驾GOWEI电动三轮车",6e55244068833a1baa53a870a45de67b,GOWEI
"这张图片显示了一辆两轮电动车的内部结构部分，具体是车体的一个黑色的塑料部件。这个部件表面略显光滑，中间有一个带螺丝固定的金属板。整个场景背景模糊，聚焦在电动车内部结构上。,GW-RN3--两轮电动车",df74bc6cb43a1506e2e8ba1b66f998d3,GOWEI
这张图片展示了一辆停在城市街道旁的GOWEI品牌的不锈钢电动三轮车。三轮车的设计注重实用性，具有宽大的不锈钢货箱，便于运载各种物品。背景是现代建筑和停放的汽车，突显了这种电动三轮车在现代城市环境中的使用场景。,2fb8c2ef75fa8def8e04d862957e3c9d,GOWEI
"这张图片展示了一个两轮电动车的前轮和刹车装置。轮胎上标记有“CST”和型号信息，而制动器上刻有“Govecs”品牌标志。整个装置显得较为现代和精密，背景中可以模糊地看到几个行人和停放的汽车。,GW-RN3--两轮电动车",bafc881336fd05c4cd75cc4d43456cfa,GOWEI
这张图片显示了一对戴着口罩的人乘坐在一辆装载有多种物品的蓝色Gowei品牌电动三轮车上。三轮车装载区装有多样的物品，包括厨房用具和一些容器，看起来像是用于商业或街头销售的设置。这种电动三轮车通常用于日常运输和小型商业活动，在城市和乡村地区都很常见。背景是一片绿色植被和一块带有彩色图案的大型广告牌。,f2fdfcf7727bc1ee029d524f4ebad05e,GOWEI
"这张图片展示了一辆Gowei品牌的电动三轮车停在沙砾覆盖的地面上，周围环境看起来像是干燥的灌木丛生地区。三轮车的车厢部分为蓝色，前方设有驾驶座椅和方向把手。阳光从左侧照射而来，天气看起来很晴朗。图片中也可以部分看到一位穿着黄色上衣的人站在三轮车旁边。,Gowei电动三轮车日常使用",daaa8abd18d80a7d7363f13a2e5abae7,GOWEI
这张图片显示了一辆名为“GW-RN3”的两轮电动车的车尾细节。电动车为银白色，配有后置储物箱。车尾灯设计独特，中间有一个环形的红色灯圈。电动车后牌照下方装有一个红色的反光条，提高夜间行驶的安全性。背景为一条城市道路，周围停有多辆汽车，可见部分建筑和绿化。,1087813941d99e6c96ef3309dbdb398c,GOWEI
"图中显示一辆标记有“Gowei”标志的蓝色电动三轮车停在土质道路上。三轮车的设计主要是货运型，车厢开放，边框颜色鲜明。背景是晴朗的天空和稀疏的灌木环境。此外，还有一位身穿条纹上衣的男士站在三轮车旁边。,Gowei电动三轮车日常使用",f08a7911049b26d91b6169b2d2a76ae7,GOWEI
