id,level,title,type,description,source_id,community,degree,human_readable_id,id,size,graph_embedding,top_level_node_id,x,y
1,0,"""TIM""","""PERSON""","Tim is an eight-year-old boy who has embarked on a journey to learn programming, demonstrating immense curiosity and dedication. He is passionate about coding and dreams of creating apps that can solve real-world problems.","1bfb8f8d20c083895dc584e5813533e3,d86adcc98f1257a19b4f8e8e146104d9",0,5,0,b45241d70f0e43fca764df95b2b81f77,5,,b45241d70f0e43fca764df95b2b81f77,0,0
2,0,"""SCRATCH""","""ORGANIZATION""","""Scratch is a visual programming language that Tim used to learn the basics of coding, enabling him to create interactive stories and games.""",1bfb8f8d20c083895dc584e5813533e3,0,1,1,4119fd06010c494caa07f439b333f4c5,1,,4119fd06010c494caa07f439b333f4c5,0,0
3,0,"""TIM'S PARENTS""","""PERSON""","Tim's Parents are supportive figures who recognized his passion for programming and enrolled him in a beginner's course. They continue to support his coding endeavors, marveling at his dedication.","1bfb8f8d20c083895dc584e5813533e3,d86adcc98f1257a19b4f8e8e146104d9",0,1,2,d3835bf3dda84ead99deadbeac5d0d7d,1,,d3835bf3dda84ead99deadbeac5d0d7d,0,0
4,0,"""BEGINNER'S PROGRAMMING COURSE""","""EVENT""","""The Beginner's Programming Course is where Tim learned the basics of coding using Scratch, marking the start of his programming journey.""",1bfb8f8d20c083895dc584e5813533e3,0,1,3,077d2820ae1845bcbb1803379a3d1eae,1,,077d2820ae1845bcbb1803379a3d1eae,0,0
5,0,"""PROGRAMMING""","""EVENT""","""Programming is the activity Tim engages in, which he uses to solve real-world problems and create apps.""",d86adcc98f1257a19b4f8e8e146104d9,0,1,4,3671ea0dd4e84c1a9b02c5ab2c8f4bac,1,,3671ea0dd4e84c1a9b02c5ab2c8f4bac,0,0
6,0,"""DIGITAL AGE""","""EVENT""","""Digital Age is the broader context in which Tim's story unfolds, promising innovation and inspiration.""",d86adcc98f1257a19b4f8e8e146104d9,0,1,5,19a7f254a5d64566ab5cc15472df02de,1,,19a7f254a5d64566ab5cc15472df02de,0,0
